{
  "id": "tesla-model-3-2025-long-range-awd",
  "vertical": "ev",
  "manufacturer": "Tesla",
  "model": "Model 3",
  "model_year": 2025,
  "trim": "Long Range AWD",
  "epa_vehicle_id": 48764,
  "v_class": "Midsize Cars",
  "drive": "AWD",
  "ev_motor": "85 and 88 kW ACPM 3-Phase",
  "msrp_usd_base": 47490,
  "destination_fee_usd": 1390,
  "msrp_usd_delivered_min": 48880,
  "epa": {
    "range_combined_mi": 346,
    "range_city_mi": 360,
    "range_highway_mi": 329,
    "mpge_combined": 128,
    "mpge_city": 133,
    "mpge_highway": 122,
    "annual_fuel_cost_usd": 600,
    "level2_240v_hours_full_charge": 11.7
  },
  "manufacturer_claims": {
    "peak_dc_charge_kw": 250,
    "fsd_subscription_usd_per_month": 99
  },
  "production_status": "in_production",
  "sources": [
    {
      "tier": 1,
      "name": "EPA fueleconomy.gov vehicle 48764",
      "url": "https://www.fueleconomy.gov/feg/Find.do?action=sbs&id=48764",
      "accessed_date": "2026-04-25"
    }
  ],
  "first_documented": "2026-04-25",
  "last_verified": "2026-04-25",
  "nhtsa": {
    "recall_count": 3,
    "recall_url": "https://www.nhtsa.gov/recalls?make=tesla&model=model%203&year=2025",
    "campaign_numbers": [
      "24V935000",
      "25V002000",
      "25V690000"
    ],
    "components_affected": [
      "BACK OVER PREVENTION",
      "ELECTRICAL SYSTEM",
      "TIRES"
    ],
    "last_checked": "2026-04-25"
  }
}
