{
  "id": "rivian-r1s-2025-dual-max",
  "vertical": "ev",
  "manufacturer": "Rivian",
  "model": "R1S",
  "model_year": 2025,
  "trim": "Dual Max (20in)",
  "epa_vehicle_id": 48433,
  "v_class": "Standard Sport Utility Vehicle 4WD",
  "drive": "4WD",
  "ev_motor": "264 and 264 kW ACPM (Dual-Motor; Max battery)",
  "battery_kwh_total": 141.5,
  "msrp_usd_base": 89900,
  "msrp_usd_delivered_min": 94550,
  "notes": {
    "msrp_usd_delivered_min": "Consumer Reports purchased a 2025 R1S Dual Max for $94,550 anonymously, as their published purchase price."
  },
  "epa": {
    "range_combined_mi": 410,
    "level2_240v_hours_full_charge": 15.0
  },
  "manufacturer_claims": {
    "peak_dc_charge_kw": 220,
    "level2_charge_miles_per_hour": 28
  },
  "production_status": "in_production",
  "sources": [
    {
      "tier": 1,
      "name": "EPA fueleconomy.gov \u2014 2025 Rivian R1S Dual Max",
      "url": "https://www.fueleconomy.gov/feg/Find.do?action=sbs&id=48433",
      "accessed_date": "2026-04-25"
    },
    {
      "tier": 2,
      "name": "Consumer Reports \u2014 2025 Rivian R1S Road Test Report",
      "url": "https://www.consumerreports.org/cars/rivian/r1s/2025/road-test-report/",
      "accessed_date": "2026-04-25"
    }
  ],
  "first_documented": "2026-04-25",
  "last_verified": "2026-04-25",
  "nhtsa": {
    "recall_count": 9,
    "recall_url": "https://www.nhtsa.gov/recalls?make=rivian&model=r1s&year=2025",
    "campaign_numbers": [
      "24V686000",
      "24V827000",
      "25V085000",
      "25V370000",
      "25V387000",
      "25V537000",
      "25V585000",
      "26V003000",
      "26V009000"
    ],
    "components_affected": [
      "ELECTRICAL SYSTEM",
      "EXTERIOR LIGHTING",
      "SEAT BELTS",
      "SUSPENSION",
      "VEHICLE SPEED CONTROL"
    ],
    "last_checked": "2026-04-25"
  }
}
